no,url,title_abstract,title,abstract
71,https://arxiv.org/abs/2305.09253,"('Title:Online Continual Learning Without the Storage Constraint', ""Abstract:Traditional online continual learning (OCL) research has primarily focused on mitigating catastrophic forgetting with fixed and limited storage allocation throughout an agent's lifetime. However, a broad range of real-world applications are primarily constrained by computational costs rather than storage limitations. In this paper, we target such applications, investigating the online continual learning problem under relaxed storage constraints and limited computational budgets. We contribute a simple algorithm, which updates a kNN classifier continually along with a fixed, pretrained feature extractor. We selected this algorithm due to its exceptional suitability for online continual learning. It can adapt to rapidly changing streams, has zero stability gap, operates within tiny computational budgets, has low storage requirements by only storing features, and has a consistency property: It never forgets previously seen data. These attributes yield significant improvements, allowing our proposed algorithm to outperform existing methods by over 20% in accuracy on two large-scale OCL datasets: Continual LOCalization (CLOC) with 39M images and 712 classes and Continual Google Landmarks V2 (CGLM) with 580K images and 10,788 classes, even when existing methods retain all previously seen images. Furthermore, we achieve this superior performance with considerably reduced computational and storage expenses. We provide code to reproduce our results at this http URL."")",Title:Online Continual Learning Without the Storage Constraint,"Abstract:Traditional online continual learning (OCL) research has primarily focused on mitigating catastrophic forgetting with fixed and limited storage allocation throughout an agent's lifetime. However, a broad range of real-world applications are primarily constrained by computational costs rather than storage limitations. In this paper, we target such applications, investigating the online continual learning problem under relaxed storage constraints and limited computational budgets. We contribute a simple algorithm, which updates a kNN classifier continually along with a fixed, pretrained feature extractor. We selected this algorithm due to its exceptional suitability for online continual learning. It can adapt to rapidly changing streams, has zero stability gap, operates within tiny computational budgets, has low storage requirements by only storing features, and has a consistency property: It never forgets previously seen data. These attributes yield significant improvements, allowing our proposed algorithm to outperform existing methods by over 20% in accuracy on two large-scale OCL datasets: Continual LOCalization (CLOC) with 39M images and 712 classes and Continual Google Landmarks V2 (CGLM) with 580K images and 10,788 classes, even when existing methods retain all previously seen images. Furthermore, we achieve this superior performance with considerably reduced computational and storage expenses. We provide code to reproduce our results at this http URL."
72,https://arxiv.org/abs/2305.07759,"('Title:TinyStories: How Small Can Language Models Be and Still Speak Coherent English?', ""Abstract:Language models (LMs) are powerful tools for natural language processing, but they often struggle to produce coherent and fluent text when they are small. Models with around 125M parameters such as GPT-Neo (small) or GPT-2 (small) can rarely generate coherent and consistent English text beyond a few words even after extensive training. This raises the question of whether the emergence of the ability to produce coherent English text only occurs at larger scales (with hundreds of millions of parameters or more) and complex architectures (with many layers of global attention).\nIn this work, we introduce TinyStories, a synthetic dataset of short stories that only contain words that a typical 3 to 4-year-olds usually understand, generated by GPT-3.5 and GPT-4. We show that TinyStories can be used to train and evaluate LMs that are much smaller than the state-of-the-art models (below 10 million total parameters), or have much simpler architectures (with only one transformer block), yet still produce fluent and consistent stories with several paragraphs that are diverse and have almost perfect grammar, and demonstrate reasoning capabilities.\nWe also introduce a new paradigm for the evaluation of language models: We suggest a framework which uses GPT-4 to grade the content generated by these models as if those were stories written by students and graded by a (human) teacher. This new paradigm overcomes the flaws of standard benchmarks which often requires the model's output to be very structures, and moreover provides a multidimensional score for the model, providing scores for different capabilities such as grammar, creativity and consistency.\nWe hope that TinyStories can facilitate the development, analysis and research of LMs, especially for low-resource or specialized domains, and shed light on the emergence of language capabilities in LMs."")",Title:TinyStories: How Small Can Language Models Be and Still Speak Coherent English?,"Abstract:Language models (LMs) are powerful tools for natural language processing, but they often struggle to produce coherent and fluent text when they are small. Models with around 125M parameters such as GPT-Neo (small) or GPT-2 (small) can rarely generate coherent and consistent English text beyond a few words even after extensive training. This raises the question of whether the emergence of the ability to produce coherent English text only occurs at larger scales (with hundreds of millions of parameters or more) and complex architectures (with many layers of global attention).
In this work, we introduce TinyStories, a synthetic dataset of short stories that only contain words that a typical 3 to 4-year-olds usually understand, generated by GPT-3.5 and GPT-4. We show that TinyStories can be used to train and evaluate LMs that are much smaller than the state-of-the-art models (below 10 million total parameters), or have much simpler architectures (with only one transformer block), yet still produce fluent and consistent stories with several paragraphs that are diverse and have almost perfect grammar, and demonstrate reasoning capabilities.
We also introduce a new paradigm for the evaluation of language models: We suggest a framework which uses GPT-4 to grade the content generated by these models as if those were stories written by students and graded by a (human) teacher. This new paradigm overcomes the flaws of standard benchmarks which often requires the model's output to be very structures, and moreover provides a multidimensional score for the model, providing scores for different capabilities such as grammar, creativity and consistency.
We hope that TinyStories can facilitate the development, analysis and research of LMs, especially for low-resource or specialized domains, and shed light on the emergence of language capabilities in LMs."
73,https://arxiv.org/abs/2210.13382,"('Title:Emergent World Representations: Exploring a Sequence Model Trained on a Synthetic Task', 'Abstract:Language models show a surprising range of capabilities, but the source of their apparent competence is unclear. Do these networks just memorize a collection of surface statistics, or do they rely on internal representations of the process that generates the sequences they see? We investigate this question by applying a variant of the GPT model to the task of predicting legal moves in a simple board game, Othello. Although the network has no a priori knowledge of the game or its rules, we uncover evidence of an emergent nonlinear internal representation of the board state. Interventional experiments indicate this representation can be used to control the output of the network and create ""latent saliency maps"" that can help explain predictions in human terms.')",Title:Emergent World Representations: Exploring a Sequence Model Trained on a Synthetic Task,"Abstract:Language models show a surprising range of capabilities, but the source of their apparent competence is unclear. Do these networks just memorize a collection of surface statistics, or do they rely on internal representations of the process that generates the sequences they see? We investigate this question by applying a variant of the GPT model to the task of predicting legal moves in a simple board game, Othello. Although the network has no a priori knowledge of the game or its rules, we uncover evidence of an emergent nonlinear internal representation of the board state. Interventional experiments indicate this representation can be used to control the output of the network and create ""latent saliency maps"" that can help explain predictions in human terms."
74,https://arxiv.org/abs/2305.10601,"('Title:Tree of Thoughts: Deliberate Problem Solving with Large Language Models', ""Abstract:Language models are increasingly being deployed for general problem solving across a wide range of tasks, but are still confined to token-level, left-to-right decision-making processes during inference. This means they can fall short in tasks that require exploration, strategic lookahead, or where initial decisions play a pivotal role. To surmount these challenges, we introduce a new framework for language model inference, Tree of Thoughts (ToT), which generalizes over the popular Chain of Thought approach to prompting language models, and enables exploration over coherent units of text (thoughts) that serve as intermediate steps toward problem solving. ToT allows LMs to perform deliberate decision making by considering multiple different reasoning paths and self-evaluating choices to decide the next course of action, as well as looking ahead or backtracking when necessary to make global choices. Our experiments show that ToT significantly enhances language models' problem-solving abilities on three novel tasks requiring non-trivial planning or search: Game of 24, Creative Writing, and Mini Crosswords. For instance, in Game of 24, while GPT-4 with chain-of-thought prompting only solved 4% of tasks, our method achieved a success rate of 74%. Code repo with all prompts: this https URL."")",Title:Tree of Thoughts: Deliberate Problem Solving with Large Language Models,"Abstract:Language models are increasingly being deployed for general problem solving across a wide range of tasks, but are still confined to token-level, left-to-right decision-making processes during inference. This means they can fall short in tasks that require exploration, strategic lookahead, or where initial decisions play a pivotal role. To surmount these challenges, we introduce a new framework for language model inference, Tree of Thoughts (ToT), which generalizes over the popular Chain of Thought approach to prompting language models, and enables exploration over coherent units of text (thoughts) that serve as intermediate steps toward problem solving. ToT allows LMs to perform deliberate decision making by considering multiple different reasoning paths and self-evaluating choices to decide the next course of action, as well as looking ahead or backtracking when necessary to make global choices. Our experiments show that ToT significantly enhances language models' problem-solving abilities on three novel tasks requiring non-trivial planning or search: Game of 24, Creative Writing, and Mini Crosswords. For instance, in Game of 24, while GPT-4 with chain-of-thought prompting only solved 4% of tasks, our method achieved a success rate of 74%. Code repo with all prompts: this https URL."
75,https://arxiv.org/abs/2304.02868,"('Title:Can Large Language Models Play Text Games Well? Current State-of-the-Art and Open Questions', 'Abstract:Large language models (LLMs) such as ChatGPT and GPT-4 have recently demonstrated their remarkable abilities of communicating with human users. In this technical report, we take an initiative to investigate their capacities of playing text games, in which a player has to understand the environment and respond to situations by having dialogues with the game world. Our experiments show that ChatGPT performs competitively compared to all the existing systems but still exhibits a low level of intelligence. Precisely, ChatGPT can not construct the world model by playing the game or even reading the game manual; it may fail to leverage the world knowledge that it already has; it cannot infer the goal of each step as the game progresses. Our results open up new research questions at the intersection of artificial intelligence, machine learning, and natural language processing.')",Title:Can Large Language Models Play Text Games Well? Current State-of-the-Art and Open Questions,"Abstract:Large language models (LLMs) such as ChatGPT and GPT-4 have recently demonstrated their remarkable abilities of communicating with human users. In this technical report, we take an initiative to investigate their capacities of playing text games, in which a player has to understand the environment and respond to situations by having dialogues with the game world. Our experiments show that ChatGPT performs competitively compared to all the existing systems but still exhibits a low level of intelligence. Precisely, ChatGPT can not construct the world model by playing the game or even reading the game manual; it may fail to leverage the world knowledge that it already has; it cannot infer the goal of each step as the game progresses. Our results open up new research questions at the intersection of artificial intelligence, machine learning, and natural language processing."
76,https://arxiv.org/abs/2305.12544,"('Title:Has It All Been Solved? Open NLP Research Questions Not Solved by Large Language Models', ""Abstract:Recent progress in large language models (LLMs) has enabled the deployment of many generative NLP applications. At the same time, it has also led to a misleading public discourse that ``it's all been solved.'' Not surprisingly, this has, in turn, made many NLP researchers -- especially those at the beginning of their careers -- worry about what NLP research area they should focus on. Has it all been solved, or what remaining questions can we work on regardless of LLMs? To address this question, this paper compiles NLP research directions rich for exploration. We identify fourteen different research areas encompassing 45 research directions that require new research and are not directly solvable by LLMs. While we identify many research areas, many others exist; we do not cover areas currently addressed by LLMs, but where LLMs lag behind in performance or those focused on LLM development. We welcome suggestions for other research directions to include: this https URL"")",Title:Has It All Been Solved? Open NLP Research Questions Not Solved by Large Language Models,"Abstract:Recent progress in large language models (LLMs) has enabled the deployment of many generative NLP applications. At the same time, it has also led to a misleading public discourse that ``it's all been solved.'' Not surprisingly, this has, in turn, made many NLP researchers -- especially those at the beginning of their careers -- worry about what NLP research area they should focus on. Has it all been solved, or what remaining questions can we work on regardless of LLMs? To address this question, this paper compiles NLP research directions rich for exploration. We identify fourteen different research areas encompassing 45 research directions that require new research and are not directly solvable by LLMs. While we identify many research areas, many others exist; we do not cover areas currently addressed by LLMs, but where LLMs lag behind in performance or those focused on LLM development. We welcome suggestions for other research directions to include: this https URL"
77,https://arxiv.org/abs/2305.14325,"('Title:Improving Factuality and Reasoning in Language Models through Multiagent Debate', 'Abstract:Large language models (LLMs) have demonstrated remarkable capabilities in language generation, understanding, and few-shot learning in recent years. An extensive body of work has explored how their performance may be further improved through the tools of prompting, ranging from verification, self-consistency, or intermediate scratchpads. In this paper, we present a complementary approach to improve language responses where multiple language model instances propose and debate their individual responses and reasoning processes over multiple rounds to arrive at a common final answer. Our findings indicate that this approach significantly enhances mathematical and strategic reasoning across a number of tasks. We also demonstrate that our approach improves the factual validity of generated content, reducing fallacious answers and hallucinations that contemporary models are prone to. Our approach may be directly applied to existing black-box models and uses identical procedure and prompts for all tasks we investigate. Overall, our findings suggest that such ""society of minds"" approach has the potential to significantly advance the capabilities of LLMs and pave the way for further breakthroughs in language generation and understanding.')",Title:Improving Factuality and Reasoning in Language Models through Multiagent Debate,"Abstract:Large language models (LLMs) have demonstrated remarkable capabilities in language generation, understanding, and few-shot learning in recent years. An extensive body of work has explored how their performance may be further improved through the tools of prompting, ranging from verification, self-consistency, or intermediate scratchpads. In this paper, we present a complementary approach to improve language responses where multiple language model instances propose and debate their individual responses and reasoning processes over multiple rounds to arrive at a common final answer. Our findings indicate that this approach significantly enhances mathematical and strategic reasoning across a number of tasks. We also demonstrate that our approach improves the factual validity of generated content, reducing fallacious answers and hallucinations that contemporary models are prone to. Our approach may be directly applied to existing black-box models and uses identical procedure and prompts for all tasks we investigate. Overall, our findings suggest that such ""society of minds"" approach has the potential to significantly advance the capabilities of LLMs and pave the way for further breakthroughs in language generation and understanding."
78,https://arxiv.org/abs/2305.15076,"('Title:Meta-Learning Online Adaptation of Language Models', 'Abstract:Large language models encode impressively broad world knowledge in their parameters. However, the knowledge in static language models falls out of date, limiting the model\'s effective ""shelf life."" While online fine-tuning can reduce this degradation, we find that naively fine-tuning on a stream of documents leads to a low level of information uptake. We hypothesize that online fine-tuning does not sufficiently attend to important information. That is, the gradient signal from important tokens representing factual information is drowned out by the gradient from inherently noisy tokens, suggesting that a dynamic, context-aware learning rate may be beneficial. We therefore propose learning which tokens to upweight. We meta-train a small, autoregressive model to reweight the language modeling loss for each token during online fine-tuning, with the objective of maximizing the out-of-date base question-answering model\'s ability to answer questions about a document after a single weighted gradient step. We call this approach Context-aware Meta-learned Loss Scaling (CaMeLS). Across three different distributions of documents, our experiments find that CaMeLS provides substantially improved information uptake on streams of thousands of documents compared with standard fine-tuning and baseline heuristics for reweighting token losses.')",Title:Meta-Learning Online Adaptation of Language Models,"Abstract:Large language models encode impressively broad world knowledge in their parameters. However, the knowledge in static language models falls out of date, limiting the model's effective ""shelf life."" While online fine-tuning can reduce this degradation, we find that naively fine-tuning on a stream of documents leads to a low level of information uptake. We hypothesize that online fine-tuning does not sufficiently attend to important information. That is, the gradient signal from important tokens representing factual information is drowned out by the gradient from inherently noisy tokens, suggesting that a dynamic, context-aware learning rate may be beneficial. We therefore propose learning which tokens to upweight. We meta-train a small, autoregressive model to reweight the language modeling loss for each token during online fine-tuning, with the objective of maximizing the out-of-date base question-answering model's ability to answer questions about a document after a single weighted gradient step. We call this approach Context-aware Meta-learned Loss Scaling (CaMeLS). Across three different distributions of documents, our experiments find that CaMeLS provides substantially improved information uptake on streams of thousands of documents compared with standard fine-tuning and baseline heuristics for reweighting token losses."
79,https://arxiv.org/abs/2305.14975,"('Title:Just Ask for Calibration: Strategies for Eliciting Calibrated Confidence Scores from Language Models Fine-Tuned with Human Feedback', ""Abstract:A trustworthy real-world prediction system should produce well-calibrated confidence scores; that is, its confidence in an answer should be indicative of the likelihood that the answer is correct, enabling deferral to an expert in cases of low-confidence predictions. Recent studies have shown that unsupervised pre-training produces large language models (LMs) whose conditional probabilities are remarkably well-calibrated. However, the most widely-used LMs are fine-tuned with reinforcement learning from human feedback (RLHF-LMs), and some studies have suggested that RLHF-LMs produce conditional probabilities that are very poorly calibrated. In light of this perceived weakness, we conduct a broad evaluation of methods for extracting confidence scores from RLHF-LMs. For RLHF-LMs such as ChatGPT, GPT-4, and Claude, we find that verbalized confidences emitted as output tokens are typically better-calibrated than the model's conditional probabilities on the TriviaQA, SciQ, and TruthfulQA benchmarks, often reducing the expected calibration error by a relative 50%."")",Title:Just Ask for Calibration: Strategies for Eliciting Calibrated Confidence Scores from Language Models Fine-Tuned with Human Feedback,"Abstract:A trustworthy real-world prediction system should produce well-calibrated confidence scores; that is, its confidence in an answer should be indicative of the likelihood that the answer is correct, enabling deferral to an expert in cases of low-confidence predictions. Recent studies have shown that unsupervised pre-training produces large language models (LMs) whose conditional probabilities are remarkably well-calibrated. However, the most widely-used LMs are fine-tuned with reinforcement learning from human feedback (RLHF-LMs), and some studies have suggested that RLHF-LMs produce conditional probabilities that are very poorly calibrated. In light of this perceived weakness, we conduct a broad evaluation of methods for extracting confidence scores from RLHF-LMs. For RLHF-LMs such as ChatGPT, GPT-4, and Claude, we find that verbalized confidences emitted as output tokens are typically better-calibrated than the model's conditional probabilities on the TriviaQA, SciQ, and TruthfulQA benchmarks, often reducing the expected calibration error by a relative 50%."
